{
  "receipt_version": "2.0",
  "artifact_type": "sofaction_validation_receipt",
  "receipt_id": "receipt.compiler_f3-actions-v2.sofaction-v2",
  "action": {
    "action_record_id": "compiler_f3-actions-v2",
    "sofaction_version": "2.0",
    "artifact": {
      "uri": "experiments/paper14/results/compiler_f3.sofaction",
      "digest": {
        "algorithm": "sha256",
        "value": "397fa29a13782368a9af68837c7318f57bb59f1780d7e74253551146c14f14b5"
      }
    }
  },
  "validator": {
    "validator_id": "paper14.sofaction-validator.v2",
    "validator_version": "2.0",
    "implementation": {
      "uri": "experiments/paper14/validate_sofaction.py",
      "digest": {
        "algorithm": "sha256",
        "value": "14f0d88010df5537d183cfea37f2b95b1e43d31277a5addfde6b6e0a0572b8c0"
      }
    },
    "receipt_contract": {
      "uri": "schemas/sofaction/validation-receipt-v2.0.schema.json",
      "digest": {
        "algorithm": "sha256",
        "value": "01c5aa155d84fe9df45d5c9629c205f8801019fc2c47983015b1beaeefcf6f1b"
      }
    }
  },
  "artifact_closure": {
    "artifact_count": 7,
    "ordered_artifacts": [
      {
        "role": "action",
        "artifact": {
          "uri": "experiments/paper14/results/compiler_f3.sofaction",
          "digest": {
            "algorithm": "sha256",
            "value": "397fa29a13782368a9af68837c7318f57bb59f1780d7e74253551146c14f14b5"
          }
        }
      },
      {
        "role": "source-audit",
        "artifact": {
          "uri": "experiments/paper13/results/audits/compiler_f3.sofaudit.json",
          "digest": {
            "algorithm": "sha256",
            "value": "c93bdffc78a6e90c8a8d480c2ebbffaedfabe9061e46404d1c20da42cb83eeb9"
          }
        }
      },
      {
        "role": "source-audit-validation-receipt",
        "artifact": {
          "uri": "experiments/paper13/results/receipts/compiler_f3.validation-receipt.json",
          "digest": {
            "algorithm": "sha256",
            "value": "c8e30bfe6a64ea2da7261577919b32a15bbf22c73148f85b99755837183b82ae"
          }
        }
      },
      {
        "role": "normative-basis-0",
        "artifact": {
          "uri": "papers/paper14/Paper XIV.md",
          "digest": {
            "algorithm": "sha256",
            "value": "ba0fa73a5f842b3fc44a5e8296708e4f8296bd8f7b9b1bf8dc1b656d7f0e2b02"
          }
        }
      },
      {
        "role": "normative-basis-1",
        "artifact": {
          "uri": "papers/paper14/Paper XIV.md",
          "digest": {
            "algorithm": "sha256",
            "value": "ba0fa73a5f842b3fc44a5e8296708e4f8296bd8f7b9b1bf8dc1b656d7f0e2b02"
          }
        }
      },
      {
        "role": "validator-implementation",
        "artifact": {
          "uri": "experiments/paper14/validate_sofaction.py",
          "digest": {
            "algorithm": "sha256",
            "value": "14f0d88010df5537d183cfea37f2b95b1e43d31277a5addfde6b6e0a0572b8c0"
          }
        }
      },
      {
        "role": "validation-receipt-contract",
        "artifact": {
          "uri": "schemas/sofaction/validation-receipt-v2.0.schema.json",
          "digest": {
            "algorithm": "sha256",
            "value": "01c5aa155d84fe9df45d5c9629c205f8801019fc2c47983015b1beaeefcf6f1b"
          }
        }
      }
    ],
    "closure_digest": {
      "algorithm": "sha256",
      "value": "42c18008f982ddd8657815356ef095059001e02074112689c2a8b82560b2659e"
    }
  },
  "status": "PASS",
  "checks": [
    {
      "check_id": "schema-validation",
      "status": "PASS"
    },
    {
      "check_id": "artifact-digest-closure",
      "status": "PASS"
    },
    {
      "check_id": "action-context-policy-admission",
      "status": "PASS"
    },
    {
      "check_id": "audit-projection-preservation",
      "status": "PASS"
    },
    {
      "check_id": "predicate-replay",
      "status": "PASS"
    },
    {
      "check_id": "candidate-set-regeneration",
      "status": "PASS"
    },
    {
      "check_id": "disposition-closure",
      "status": "PASS"
    },
    {
      "check_id": "authorization-boundary",
      "status": "PASS"
    }
  ],
  "negative_boundaries": [
    "This receipt establishes interpretation and candidate-set protocol conformance only; it does not establish policy correctness, action feasibility, authorization, or causal effect."
  ]
}
