{
  "receipt_version": "2.0",
  "artifact_type": "sofaction_validation_receipt",
  "receipt_id": "receipt.before_after_traffic-actions-v2.sofaction-v2",
  "action": {
    "action_record_id": "before_after_traffic-actions-v2",
    "sofaction_version": "2.0",
    "artifact": {
      "uri": "experiments/paper14/results/before_after_traffic.sofaction",
      "digest": {
        "algorithm": "sha256",
        "value": "062174ab1275472d6ce01c45447c305f92354cd745c607f43887f57f83a02e13"
      }
    }
  },
  "validator": {
    "validator_id": "paper14.sofaction-validator.v2",
    "validator_version": "2.0",
    "implementation": {
      "uri": "experiments/paper14/validate_sofaction.py",
      "digest": {
        "algorithm": "sha256",
        "value": "14f0d88010df5537d183cfea37f2b95b1e43d31277a5addfde6b6e0a0572b8c0"
      }
    },
    "receipt_contract": {
      "uri": "schemas/sofaction/validation-receipt-v2.0.schema.json",
      "digest": {
        "algorithm": "sha256",
        "value": "01c5aa155d84fe9df45d5c9629c205f8801019fc2c47983015b1beaeefcf6f1b"
      }
    }
  },
  "artifact_closure": {
    "artifact_count": 7,
    "ordered_artifacts": [
      {
        "role": "action",
        "artifact": {
          "uri": "experiments/paper14/results/before_after_traffic.sofaction",
          "digest": {
            "algorithm": "sha256",
            "value": "062174ab1275472d6ce01c45447c305f92354cd745c607f43887f57f83a02e13"
          }
        }
      },
      {
        "role": "source-audit",
        "artifact": {
          "uri": "experiments/paper13/results/audits/before_after_traffic.sofaudit.json",
          "digest": {
            "algorithm": "sha256",
            "value": "13f8a8523aaf00728c8003c2cd6bc91576971f77390a4b6da4d1eccb5c853fa7"
          }
        }
      },
      {
        "role": "source-audit-validation-receipt",
        "artifact": {
          "uri": "experiments/paper13/results/receipts/before_after_traffic_retiming.validation-receipt.json",
          "digest": {
            "algorithm": "sha256",
            "value": "771c2403094f36ede938187926a2f64130d7736acaee3157c59f225bcd82b032"
          }
        }
      },
      {
        "role": "normative-basis-0",
        "artifact": {
          "uri": "papers/paper14/Paper XIV.md",
          "digest": {
            "algorithm": "sha256",
            "value": "ba0fa73a5f842b3fc44a5e8296708e4f8296bd8f7b9b1bf8dc1b656d7f0e2b02"
          }
        }
      },
      {
        "role": "normative-basis-1",
        "artifact": {
          "uri": "papers/paper14/Paper XIV.md",
          "digest": {
            "algorithm": "sha256",
            "value": "ba0fa73a5f842b3fc44a5e8296708e4f8296bd8f7b9b1bf8dc1b656d7f0e2b02"
          }
        }
      },
      {
        "role": "validator-implementation",
        "artifact": {
          "uri": "experiments/paper14/validate_sofaction.py",
          "digest": {
            "algorithm": "sha256",
            "value": "14f0d88010df5537d183cfea37f2b95b1e43d31277a5addfde6b6e0a0572b8c0"
          }
        }
      },
      {
        "role": "validation-receipt-contract",
        "artifact": {
          "uri": "schemas/sofaction/validation-receipt-v2.0.schema.json",
          "digest": {
            "algorithm": "sha256",
            "value": "01c5aa155d84fe9df45d5c9629c205f8801019fc2c47983015b1beaeefcf6f1b"
          }
        }
      }
    ],
    "closure_digest": {
      "algorithm": "sha256",
      "value": "770ac340365e2469fa475e48e12c538ef0a0d81f8695ac4098f6004accc66ab1"
    }
  },
  "status": "PASS",
  "checks": [
    {
      "check_id": "schema-validation",
      "status": "PASS"
    },
    {
      "check_id": "artifact-digest-closure",
      "status": "PASS"
    },
    {
      "check_id": "action-context-policy-admission",
      "status": "PASS"
    },
    {
      "check_id": "audit-projection-preservation",
      "status": "PASS"
    },
    {
      "check_id": "predicate-replay",
      "status": "PASS"
    },
    {
      "check_id": "candidate-set-regeneration",
      "status": "PASS"
    },
    {
      "check_id": "disposition-closure",
      "status": "PASS"
    },
    {
      "check_id": "authorization-boundary",
      "status": "PASS"
    }
  ],
  "negative_boundaries": [
    "This receipt establishes interpretation and candidate-set protocol conformance only; it does not establish policy correctness, action feasibility, authorization, or causal effect."
  ]
}
